{
  "id": "control.suspend",
  "version": 1,
  "kind": "command",
  "effect": "mutating",
  "input": {
    "schema": "ControlSuspendRequest"
  },
  "output": {
    "schema": "Control"
  },
  "authorization": {
    "permission": "control:suspend"
  },
  "tenancy": {
    "required": true
  },
  "delegation": {
    "required": true
  },
  "idempotency": {
    "required": true
  },
  "concurrency": {
    "strategy": "none"
  },
  "execution": {
    "semantics": "atomic"
  },
  "preconditions": {
    "freshness": "current",
    "predicates": []
  },
  "controls": [],
  "risk": {
    "level": "high"
  },
  "audit": {
    "level": "full"
  },
  "extensions": {
    "com.panaversity.tutorial": {
      "example_request": {
        "target": "dsor://org_456/agent/accounts-payable-fte",
        "suspended": true,
        "reason": "paying the wrong invoices"
      }
    }
  }
}
